{
  "schema_version": "sourceos.policy-observation.v0.1",
  "observation_id": "policy_expected_metadata_boundary_shell_launch",
  "explanation_code": "POLICY_EXPECTED_METADATA_BOUNDARY",
  "policy_bundle": "sourceos.baseline.telemetry",
  "policy_rule": "telemetry-agent.filesystem.executable-metadata-only",
  "actor": {
    "actor_id": "actor_internal_telemetry_component",
    "actor_type": "service",
    "display_name": "internal telemetry component",
    "uid": "system-service",
    "session_id": null,
    "authority_domain": "system_service"
  },
  "subject": {
    "type": "file",
    "id": "target_package_binary_directory",
    "display": "package-managed executable directory"
  },
  "operation": "file-read-data",
  "target_class": "package_binary_directory",
  "result": "deny",
  "causality": {
    "parent_event_id": "evt_shell_launch_20260504_192158",
    "root_event_id": "evt_shell_launch_20260504_192158",
    "trace_id": "trace_shell_launch_20260504_192158",
    "span_id": "span_policy_metadata_boundary"
  },
  "privacy": {
    "tier": "user_private",
    "redaction_policy": "preserve_causality",
    "secret_fields": ["exact_target_path"]
  },
  "evidence": [
    {
      "evidence_id": "ev_policy_obs_metadata_boundary",
      "source": "kernel",
      "raw_ref": "rawlog:console-export:19:21:58.394",
      "summary": "Telemetry component was denied direct file-data reads against a package-managed executable path."
    }
  ]
}
